{
  "v": 1,
  "venue": "lima",
  "note": "Café Lima: a first draft drawn from six photos (13 Oct 2026). Every measure is an estimate (about ±0.5 m); no people, no photos in this file. Self-service: guests order at the counter.",
  "room": { "w": 16, "d": 11.2 },
  "walls": [
    { "from": [0, 4], "to": [1.2, 4], "kind": "wall" },
    { "from": [1.2, 4], "to": [2.6, 4], "kind": "window" },
    { "from": [2.6, 4], "to": [6.6, 4], "kind": "wall" },
    { "from": [6.6, 4], "to": [8.6, 4], "kind": "window" },
    { "from": [8.6, 4], "to": [10.7, 4], "kind": "wall" },
    { "from": [10.7, 4], "to": [12.9, 4], "kind": "door", "gap": [0.1, 2.2] },
    { "from": [12.9, 4], "to": [13.6, 4], "kind": "window" },
    { "from": [13.6, 4], "to": [16, 4], "kind": "wall" },
    { "from": [6, 4], "to": [6, 8], "kind": "wall" },
    { "from": [6, 8], "to": [10.6, 8], "kind": "door", "gap": [1.6, 2.6] },
    { "from": [10.6, 5.6], "to": [10.6, 8], "kind": "window" },
    { "from": [10.6, 8], "to": [10.6, 11], "kind": "wall" },
    { "from": [10.6, 11], "to": [15.6, 11], "kind": "door", "gap": [2.2, 3.0] },
    { "from": [15.6, 11], "to": [15.6, 4], "kind": "wall" }
  ],
  "zones": [
    { "id": "street", "name": { "he": "בשורה ליד הרחוב", "en": "By the street" }, "rect": [0, 1.2, 16, 2.6], "outdoor": true },
    { "id": "wall", "name": { "he": "לאורך הקיר", "en": "Along the wall" }, "rect": [0, 2.6, 16, 4], "outdoor": true },
    { "id": "door", "name": { "he": "ליד הדלת", "en": "By the door" }, "rect": [10.6, 4, 13.9, 7.8], "outdoor": false },
    { "id": "row", "name": { "he": "שורת הספסל", "en": "The banquette row" }, "rect": [13.9, 4, 15.6, 11], "outdoor": false },
    { "id": "lounge", "name": { "he": "פינת הספות", "en": "The sofa corner" }, "rect": [10.6, 7.8, 13.9, 11], "outdoor": false }
  ],
  "tables": [
    { "id": "t1", "zone": "wall", "x": 1.4, "z": 3.0, "rot": 90, "shape": "long", "seats": 4, "minParty": 2, "maxParty": 4, "bookable": true, "look": { "top": "wood", "seat": "chairs", "w": 1.4, "d": 0.8 } },
    { "id": "t2", "zone": "wall", "x": 3.0, "z": 3.35, "rot": 0, "shape": "round", "seats": 2, "minParty": 1, "maxParty": 2, "bookable": true, "look": { "top": "marble", "seat": "bench", "w": 0.6 } },
    { "id": "t3", "zone": "wall", "x": 4.5, "z": 3.35, "rot": 0, "shape": "round", "seats": 2, "minParty": 1, "maxParty": 2, "bookable": true, "look": { "top": "marble", "seat": "bench", "w": 0.6 } },
    { "id": "t4", "zone": "wall", "x": 7.0, "z": 3.15, "rot": 0, "shape": "round", "seats": 2, "minParty": 1, "maxParty": 2, "bookable": true, "look": { "top": "iron", "seat": "chairs", "w": 0.6 } },
    { "id": "t5", "zone": "wall", "x": 9.7, "z": 3.2, "rot": 0, "shape": "round", "seats": 2, "minParty": 1, "maxParty": 2, "bookable": true, "look": { "top": "marble", "seat": "chairs", "w": 0.6 } },
    { "id": "t6", "zone": "wall", "x": 14.8, "z": 3.3, "rot": 0, "shape": "long", "seats": 4, "minParty": 2, "maxParty": 4, "bookable": true, "look": { "top": "wood", "seat": "bench", "w": 1.6, "d": 0.75 } },
    { "id": "t7", "zone": "street", "x": 3.8, "z": 2.05, "rot": 0, "shape": "round", "seats": 2, "minParty": 1, "maxParty": 2, "bookable": true, "look": { "top": "marble", "seat": "stools", "w": 0.6 } },
    { "id": "t8", "zone": "street", "x": 11.3, "z": 2.0, "rot": 0, "shape": "round", "seats": 3, "minParty": 1, "maxParty": 3, "bookable": true, "look": { "top": "marble", "seat": "chairs", "w": 0.65 } },
    { "id": "t9", "zone": "street", "x": 13.1, "z": 2.25, "rot": 90, "shape": "long", "seats": 4, "minParty": 2, "maxParty": 4, "bookable": true, "look": { "top": "glass", "seat": "chairs", "w": 1.2, "d": 0.65 } },
    { "id": "t10", "zone": "street", "x": 14.8, "z": 1.75, "rot": 0, "shape": "round", "seats": 2, "minParty": 1, "maxParty": 2, "bookable": true, "look": { "top": "marble", "seat": "chairs", "w": 0.6 } },
    { "id": "i1", "zone": "door", "x": 11.8, "z": 5.4, "rot": 0, "shape": "round", "seats": 3, "minParty": 1, "maxParty": 3, "bookable": true, "look": { "top": "marble", "seat": "chairs", "w": 0.65 } },
    { "id": "r1", "zone": "row", "x": 14.85, "z": 5.3, "rot": 0, "shape": "round", "seats": 3, "minParty": 1, "maxParty": 3, "bookable": true, "look": { "top": "marble", "seat": "velvet", "w": 0.65 } },
    { "id": "r2", "zone": "row", "x": 14.85, "z": 6.7, "rot": 0, "shape": "round", "seats": 2, "minParty": 1, "maxParty": 2, "bookable": true, "look": { "top": "marble", "seat": "velvet", "w": 0.65 } },
    { "id": "r3", "zone": "row", "x": 14.85, "z": 8.1, "rot": 0, "shape": "round", "seats": 2, "minParty": 1, "maxParty": 2, "bookable": true, "look": { "top": "marble", "seat": "velvet", "w": 0.65 } },
    { "id": "r4", "zone": "row", "x": 14.85, "z": 9.5, "rot": 0, "shape": "round", "seats": 3, "minParty": 1, "maxParty": 3, "bookable": true, "look": { "top": "marble", "seat": "velvet", "w": 0.65 } },
    { "id": "l1", "zone": "lounge", "x": 12.0, "z": 9.75, "rot": 0, "shape": "square", "seats": 4, "minParty": 2, "maxParty": 4, "bookable": true, "look": { "top": "wood", "seat": "sofa", "w": 0.7, "d": 0.5 } }
  ],
  "fixtures": [
    { "kind": "walkway", "rect": [0, 0, 16, 1.2], "name": { "he": "המדרכה · פנויה להולכי רגל", "en": "The pavement · kept clear" } },
    { "kind": "closed", "rect": [0, 4, 6, 11.2] },
    { "kind": "closed", "rect": [15.6, 4, 16, 11.2] },
    { "kind": "kitchen", "rect": [6, 8, 10.6, 11.2], "name": { "he": "המטבח", "en": "The kitchen" } },
    { "kind": "hatch", "rect": [6.6, 3.9, 8.6, 4.1], "name": { "he": "החלון לרחוב", "en": "The street window" } },
    { "kind": "fridge", "rect": [7.5, 3.62, 8.2, 4] },
    { "kind": "counter", "rect": [7.0, 5.6, 10.2, 6.2], "name": { "he": "הדלפק · מזמינים כאן", "en": "The counter · order here" } },
    { "kind": "vitrine", "rect": [8.5, 5.6, 10.2, 6.2] },
    { "kind": "espresso", "at": [7.55, 5.9] },
    { "kind": "shelf", "rect": [10.66, 6.0, 10.96, 7.6], "name": { "he": "מדף היין והקפה", "en": "Wine and coffee shelf" } },
    { "kind": "banquette", "rect": [15.2, 4.6, 15.6, 10.4] },
    { "kind": "bench", "rect": [2.3, 3.62, 5.4, 4] },
    { "kind": "bench", "rect": [14.0, 3.65, 15.6, 4] },
    { "kind": "awning", "rect": [0, 1.4, 5.7, 4] },
    { "kind": "awning", "rect": [5.7, 1.4, 10.6, 4] },
    { "kind": "awning", "rect": [10.6, 1.4, 16, 4] },
    { "kind": "post", "at": [5.7, 2.4] },
    { "kind": "post", "at": [10.6, 2.4] },
    { "kind": "planter", "at": [6.12, 3.68] },
    { "kind": "tree", "at": [0.6, 0.6] },
    { "kind": "lamp", "at": [14.25, 6.0] },
    { "kind": "lamp", "at": [14.25, 8.8] },
    { "kind": "lamp", "at": [12.4, 7.2] }
  ]
}
